{
  "kind": "crisis",
  "id": "cr.hailstorm",
  "name": "Hailstorm",
  "prevent": [
    "tool"
  ],
  "fail": [
    {
      "op": "removeBarricade",
      "count": "all",
      "scope": {
        "who": "allLocations"
      }
    },
    {
      "code": "crisis.hailstorm.frostbiteRolls"
    }
  ],
  "bonus": {
    "extraCards": 2,
    "effect": [
      {
        "op": "morale",
        "value": 1
      }
    ]
  },
  "text": {
    "fail": "Hail strips every barricade from every location, and each player still in the colony rolls a die: on a 4 or less one of their survivors gets frostbite. No morale is lost.",
    "bonus": "Two cards beyond the need lift morale by 1."
  },
  "sources": {
    "prevent": "VASSAL v1.1 Crisis_Hailstorm.jpg",
    "fail": "VASSAL v1.1 Crisis_Hailstorm.jpg",
    "bonus": "VASSAL v1.1 Crisis_Hailstorm.jpg"
  },
  "status": "verified",
  "notes": "Clean scan reads in full: Tool symbol, every non-exiled player rolls a die and on 4 or less puts a frostbite wound on one survivor they control, all barricades come off every location, no morale loss. Matches hook crisis.hailstorm.frostbiteRolls.",
  "tags": [
    "name-official"
  ]
}
