{
  "kind": "crisis",
  "id": "cr.blizzard",
  "name": "Blizzard",
  "prevent": [
    "fuel"
  ],
  "fail": [
    {
      "op": "forbid",
      "what": "move",
      "scope": {
        "who": "nonExiledSeats"
      },
      "duration": "nextRound"
    },
    {
      "op": "morale",
      "value": -1
    }
  ],
  "bonus": {
    "extraCards": 2,
    "effect": [
      {
        "op": "morale",
        "value": 1
      }
    ]
  },
  "text": {
    "fail": "A whiteout pins everyone in place: no one still in the colony may move until the end of next round, and morale drops by 1.",
    "bonus": "Two cards beyond the need lift morale by 1."
  },
  "sources": {
    "prevent": "VASSAL v1.1 Crisis_Blizzard.jpg",
    "fail": "VASSAL v1.1 Crisis_Blizzard.jpg",
    "bonus": "VASSAL v1.1 Crisis_Blizzard.jpg"
  },
  "status": "verified",
  "notes": "Name, Fuel symbol, no-move until the end of next round and 1 morale all match the clean scan.",
  "tags": [
    "name-official"
  ]
}
