{
  "kind": "crisis",
  "id": "cr.strength-of-the-dead",
  "name": "Strength of the Dead",
  "prevent": [
    "fuel"
  ],
  "fail": [
    {
      "op": "removeBarricade",
      "count": "all",
      "location": "colony"
    },
    {
      "op": "addZombies",
      "value": 10,
      "location": "colony"
    }
  ],
  "bonus": {
    "extraCards": 2,
    "effect": [
      {
        "op": "morale",
        "value": 1
      }
    ]
  },
  "text": {
    "fail": "The colony loses all its barricades, then ten zombies pour in. No morale is lost.",
    "bonus": "Two cards beyond the need lift morale by 1."
  },
  "sources": {
    "prevent": "VASSAL v1.1 Crisis_Strength_Of_The_Dead.jpg",
    "fail": "VASSAL v1.1 Crisis_Strength_Of_The_Dead.jpg",
    "bonus": "VASSAL v1.1 Crisis_Strength_Of_The_Dead.jpg"
  },
  "status": "verified",
  "notes": "Scan: Fuel symbol, all colony barricades removed then 10 zombies added at the colony, no morale loss.",
  "tags": [
    "name-official"
  ]
}
