{
  "kind": "crisis",
  "id": "cr.overpopulation",
  "name": "Overpopulation",
  "prevent": [
    "food"
  ],
  "fail": [
    {
      "code": "crisis.overpopulation.killLowestTwo"
    }
  ],
  "bonus": {
    "extraCards": 2,
    "effect": [
      {
        "op": "morale",
        "value": 1
      }
    ]
  },
  "text": {
    "fail": "There are too many mouths: the two non-exiled survivors with the lowest influence die, and each death costs the usual morale.",
    "bonus": "Two cards beyond the need lift morale by 1."
  },
  "sources": {
    "prevent": "VASSAL v1.1 Crisis_Overpopulation.jpg",
    "fail": "VASSAL v1.1 Crisis_Overpopulation.jpg",
    "bonus": "VASSAL v1.1 Crisis_Overpopulation.jpg"
  },
  "status": "verified",
  "notes": "Scan: Food symbol, the 2 non-exiled survivors with the lowest influence are killed, each kill costing 1 morale as usual (R p11, p14). Matches hook crisis.overpopulation.killLowestTwo.",
  "tags": [
    "name-official"
  ]
}
