{
  "kind": "crisis",
  "id": "cr.endless-hordes",
  "name": "Unending Hordes",
  "prevent": [
    "tool"
  ],
  "fail": [
    {
      "op": "addZombies",
      "value": 8,
      "location": "colony"
    },
    {
      "op": "morale",
      "value": -1
    }
  ],
  "bonus": {
    "extraCards": 2,
    "effect": [
      {
        "op": "morale",
        "value": 1
      }
    ]
  },
  "text": {
    "fail": "Eight zombies surge against the colony and morale drops by 1.",
    "bonus": "Two cards beyond the need lift morale by 1."
  },
  "sources": {
    "prevent": "VASSAL v1.1 Crisis_Unending_Hordes.jpg",
    "fail": "VASSAL v1.1 Crisis_Unending_Hordes.jpg",
    "bonus": "VASSAL v1.1 Crisis_Unending_Hordes.jpg"
  },
  "status": "verified",
  "notes": "Official name Unending Hordes (was our Endless Hordes). Tool symbol, 8 zombies at the colony and 1 morale all match. Id kept for saves.",
  "tags": [
    "name-official"
  ]
}
