{
  "kind": "crisis",
  "id": "cr.spoiled-food",
  "name": "Food Spoilage",
  "prevent": [
    "food"
  ],
  "fail": [
    {
      "op": "forbid",
      "what": "spendFood",
      "scope": {
        "who": "nonExiledSeats"
      },
      "duration": "nextRound"
    },
    {
      "op": "morale",
      "value": -1
    }
  ],
  "bonus": {
    "extraCards": 2,
    "effect": [
      {
        "op": "morale",
        "value": 1
      }
    ]
  },
  "text": {
    "fail": "The stores have turned: until the end of next round nobody still in the colony may spend food to boost a die, and morale drops by 1.",
    "bonus": "Two cards beyond the need lift morale by 1."
  },
  "sources": {
    "prevent": "VASSAL v1.1 Crisis_Food_Spoilage.jpg",
    "fail": "VASSAL v1.1 Crisis_Food_Spoilage.jpg",
    "bonus": "VASSAL v1.1 Crisis_Food_Spoilage.jpg"
  },
  "status": "verified",
  "notes": "Clean scan reads in full: Food symbol, until the end of next round non-exiled players cannot use food tokens to raise a die, lose 1 morale. Id kept for saves.",
  "tags": [
    "name-official"
  ]
}
