{
  "kind": "crisis",
  "id": "cr.legions-of-death",
  "name": "Legions of Death",
  "prevent": [
    "fuel"
  ],
  "fail": [
    {
      "op": "addZombies",
      "value": 12,
      "location": "colony"
    }
  ],
  "bonus": {
    "extraCards": 2,
    "effect": [
      {
        "op": "morale",
        "value": 1
      }
    ]
  },
  "text": {
    "fail": "Twelve zombies crowd the colony gates. No morale is lost.",
    "bonus": "Two cards beyond the need lift morale by 1."
  },
  "sources": {
    "prevent": "BGG ludopedia-51114 (verify)",
    "fail": "BGG ludopedia-51114 (verify)",
    "bonus": "R p12"
  },
  "status": "draft",
  "notes": "src: crises-sources.md row 11 (name ours); single source",
  "tags": [
    "name-ours"
  ]
}
