{
  "kind": "crisis",
  "id": "cr.we-are-being-watched",
  "name": "They're Watching Us",
  "prevent": [
    "medicine",
    "tool"
  ],
  "fail": [
    {
      "op": "addZombies",
      "value": 3,
      "location": "loc.library"
    },
    {
      "op": "addZombies",
      "value": 3,
      "location": "loc.grocery-store"
    }
  ],
  "bonus": {
    "extraCards": 2,
    "effect": [
      {
        "op": "morale",
        "value": 1
      }
    ]
  },
  "text": {
    "fail": "Three zombies shamble into the Library and three into the Grocery Store.",
    "bonus": "Two cards beyond the need lift morale by 1."
  },
  "sources": {
    "prevent": "VASSAL v1.1 Crisis_Theyre_Watching_Us.jpg",
    "fail": "VASSAL v1.1 Crisis_Theyre_Watching_Us.jpg",
    "bonus": "VASSAL v1.1 Crisis_Theyre_Watching_Us.jpg"
  },
  "status": "verified",
  "notes": "Official name They're Watching Us (was our We Are Being Watched). Medicine or Tool, 3 zombies at the Library and 3 at the Grocery Store. Id kept for saves.",
  "tags": [
    "name-official"
  ]
}
