{
  "kind": "crisis",
  "id": "cr.despair",
  "name": "Despair",
  "prevent": [
    "medicine"
  ],
  "fail": [
    {
      "op": "morale",
      "value": -2
    }
  ],
  "bonus": {
    "extraCards": 2,
    "effect": [
      {
        "op": "morale",
        "value": 1
      }
    ]
  },
  "text": {
    "fail": "Hope drains out of the colony and morale drops by 2.",
    "bonus": "Two cards beyond the need lift morale by 1."
  },
  "sources": {
    "prevent": "VASSAL v1.1 Crisis_Despair.jpg",
    "fail": "VASSAL v1.1 Crisis_Despair.jpg",
    "bonus": "VASSAL v1.1 Crisis_Despair.jpg"
  },
  "status": "verified",
  "notes": "Official name confirmed by the clean scan (Medicine, lose 2 morale).",
  "tags": [
    "name-official"
  ]
}
