{
  "kind": "crisis",
  "id": "cr.reorganization",
  "name": "Shaking Things Up",
  "prevent": [
    "tool"
  ],
  "fail": [
    {
      "code": "crisis.reorganization.passSurvivors"
    },
    {
      "op": "morale",
      "value": -1
    }
  ],
  "bonus": {
    "extraCards": 2,
    "effect": [
      {
        "op": "morale",
        "value": 1
      }
    ]
  },
  "text": {
    "fail": "Every player still in the colony must pass one of their survivors to the player on their left, and morale drops by 1.",
    "bonus": "Two cards beyond the need lift morale by 1."
  },
  "sources": {
    "prevent": "VASSAL v1.1 Crisis_Shaking_Things_Up.jpg",
    "fail": "VASSAL v1.1 Crisis_Shaking_Things_Up.jpg",
    "bonus": "VASSAL v1.1 Crisis_Shaking_Things_Up.jpg"
  },
  "status": "verified",
  "notes": "Official name Shaking Things Up (was our Reorganization). Tool symbol, each non-exiled player gives one survivor they control to the player on their left, lose 1 morale. The hook picks the survivor for the player (printed card lets the player choose). Id and hook name kept for saves.",
  "tags": [
    "name-official"
  ]
}
